,image_path,title,author,summary,affiliation
0,./images/4d.png,(Perhaps) Beyond Human Translation: Harnessing Multi-Agent Collaboration for Translating Ultra-Long Literary Texts,"Minghao Wu, Yulin Yuan, Gholamreza Haffari, Longyue Wang","Recent advancements in machine translation (MT) have significantly enhancedtranslation quality across various domains. However, the translation of literarytexts remains a formidable challenge due to their complex language, figurative ex-pressions, and cultural nuances. In this work, we introduce a novel multi-agentframework based on large language models (LLMs) for literary translation, im-plemented as a company called TRANSAGENTS, which mirrors traditional trans-lation publication process by leveraging the collective capabilities of multipleagents, to address the intricate demands of translating literary works. To evaluatethe effectiveness of our system, we propose two innovative evaluation strategies:Monolingual Human Preference (MHP) and Bilingual LLM Preference (BLP).MHP assesses translations from the perspective of monolingual readers of the tar-get language, while BLP uses advanced LLMs to compare translations directlywith the original texts. Empirical findings indicate that despite lower d-BLEUscores, translations from TRANSAGENTS are preferred by both human evalua-tors and LLMs over human-written references, particularly in genres requiringdomain-specific knowledge. We also highlight the strengths and limitations ofTRANSAGENTS through case studies and suggests directions for future research.","Monash University, University of Macau, Tencent AI Lab"
1,./images/(perhaps)_beyond_human_translation_20240520.png,Agent Hospital: A Simulacrum of Hospital with Evolvable Medical Agents,"Junkai Li, Siyu Wang, Meng Zhang, Weitao Li, Yunghwei Lai, Xinhui Kang, Weizhi Ma, Yang Liu","In this paper, we introduce a simulacrum of hospital called Agent Hospital that simulates theentire process of treating illness. All patients, nurses, and doctors are autonomous agents powered bylarge language models (LLMs). Our central goal is to enable a doctor agent to learn how to treat illnesswithin the simulacrum. To do so, we propose a method called MedAgent-Zero. As the simulacrum cansimulate disease onset and progression based on knowledge bases and LLMs, doctor agents can keepaccumulating experience from both successful and unsuccessful cases. Simulation experiments show thatthe treatment performance of doctor agents consistently improves on various tasks. More interestingly,the knowledge the doctor agents have acquired in Agent Hospital is applicable to real-world medicarebenchmarks. After treating around ten thousand patients (real-world doctors may take over two years),the evolved doctor agent achieves a state-of-the-art accuracy of 9",Tsinghua University
2,./images/agent_hospital_a_simulacrum_20240505.png,AgentCF: Collaborative Learning with Autonomous Language Agents for Recommender Systems,"Junjie Zhang, Yupeng Hou, Ruobing Xie, Wenqi Sun, Julian McAuley, Wayne Xin Zhao, Leyu Lin, Ji-Rong Wen","Recently, there has been an emergence of employing LLM-poweredagents as believable human proxies, based on their remarkabledecision-making capability. However, existing studies mainly focuson simulating human dialogue. Human non-verbal behaviors, suchas item clicking in recommender systems, although implicitly ex-hibiting user preferences and could enhance the modeling of users,have not been deeply explored. The main reasons lie in the gapbetween language modeling and behavior modeling, as well as theincomprehension of LLMs about user-item relations.To address this issue, we propose AgentCF for simulating user-item interactions in recommender systems through agent-basedcollaborative filtering. We creatively consider not only users butalso items as agents, and develop a collaborative learning approachthat optimizes both kinds of agents together. Specifically, at eachtime step, we first prompt the user and item agents to interact au-tonomously. Then, based on the disparities between the agents’decisions and real-world interaction records, user and item agentsare prompted to reflect on and adjust the misleading simulationscollaboratively, thereby modeling their two-sided relations. The op-timized agents can also propagate their preferences to other agentsin subsequent interactions, implicitly capturing the collaborative fil-tering idea. Overall, the optimized agents exhibit diverse interactionbehaviors within our framework, including user-item, user-user,item-item, and collective interactions. The results show that theseagents can demonstrate personalized behaviors akin to those of real-world individuals, sparking the development of next-generationuser behavior simulation.","Renmin University of China, UC San Diego, Tencent"
3,./images/agentcf_collaborative_learning_with_20231013.png,AgentVerse: Facilitating Multi-Agent Collaboration and Exploring Emergent Behaviors,"Weize Chen, Yusheng Su, Jingwei Zuo, Cheng Yang, Chenfei Yuan, Chi-Min Chan, Heyang Yu, Yaxi Lu, Yi-Hsin Hung, Chen Qian, Yujia Qin, Xin Cong, Ruobing Xie, Zhiyuan Liu, Maosong Sun, Jie Zhou","Autonomous agents empowered by Large Language Models (LLMs) have under-gone significant improvements, enabling them to generalize across a broad spec-trum of tasks. However, in real-world scenarios, cooperation among individuals isoften required to enhance the efficiency and effectiveness of task accomplishment.Hence, inspired by human group dynamics, we propose a multi-agent frameworkAGENTVERSE that can effectively orchestrate a collaborative group of expert agentsas a greater-than-the-sum-of-its-parts system. Our experiments demonstrate thatAGENTVERSE can proficiently deploy multi-agent groups that outperform a singleagent. Extensive experiments on text understanding, reasoning, coding, tool utiliza-tion, and embodied AI confirm the effectiveness of AGENTVERSE. Moreover, ouranalysis of agent interactions within AGENTVERSE reveals the emergence of spe-cific collaborative behaviors, contributing to heightened group efficiency. Our codehas been released at https://github.com/OpenBMB/AgentVerse/.","Tsinghua University, Beijing University of Posts and Telecommunications, Tencent Inc."
4,./images/agentverse_facilitating_multi-agent_collaboration_20230821.png,AI Hospital: Interactive Evaluation and Collaboration of LLMs as Intern Doctors for Clinical Diagnosis,"Zhihao Fan, Jialong Tang, Wei Chen, Siyuan Wang, Zhongyu Wei, Jun Xi, Fei Huang, Jingren Zhou","The incorporation of Large Language Models(LLMs) in healthcare marks a significant ad-vancement. However, the application has pre-dominantly been limited to discriminative andquestion-answering tasks, which does not fullyleverage their interactive potential. To addressthis limitation, our paper presents AI Hospital,a framework designed to build a real-time in-teractive diagnosis environment. To simulatethe procedure, we collect high-quality medicalrecords to create patient, examiner, and medicaldirector agents. AI Hospital is then utilized forthe interactive evaluation and collaboration ofLLMs. Initially, we create a Multi-View Medi-cal Evaluation (MVME) benchmark where vari-ous LLMs serve as intern doctors for interactivediagnosis. Subsequently, to improve diagnosticaccuracy, we introduce a collaborative mech-anism that involves iterative discussions anda dispute resolution process under the supervi-sion of the medical director. In our experiments,we validate the reliability of AI Hospital. Theresults not only explore the feasibility of applyLLMs in clinical consultation but also confirmthe effectiveness of the dispute resolution fo-cused collaboration method.","Alibaba Inc., Huazhong University of Science and Technology, Fudan University"
5,./images/ai_hospital_interactive_evaluation_20240215.png,Are you in a Masquerade? Exploring the Behavior and Impact of Large Language Model Driven Social Bots in Online Social Networks,"Siyu Li, Jin Yang, Kui Zhao","As the capabilities of Large Language Models (LLMs) emerge, they not only assist in accomplishing traditional tasks within more efficient paradigms but also stimulate the evolution of social bots. Researchers have begun exploring the implementation of LLMs as the driving core of social bots, enabling more efficient and user-friendly completion of tasks like profile completion, social behavior decision-making, and social content generation. However, there is currently a lack of systematic research on the behavioral characteristics of LLMs-driven social bots and their impact on social networks. We have curated data from Chirper, a Twitter-like social network populated by LLMs-driven social bots and embarked on an exploratory study. Our findings indicate that: (1) LLMs-driven social bots possess enhanced individual-level camouflage while exhibiting certain collective characteristics; (2) these bots have the ability to exert influence on online communities through toxic behaviors; (3) existing detection methods are applicable to the activity environment of LLMs-driven social bots but may be subject to certain limitations in effectiveness. Moreover, we have organized the data collected in our study into the Masquerade-23 dataset, which we have publicly released, thus addressing the data void in the subfield of LLMs-driven social bots behavior datasets. Our research outcomes provide primary insights for the research and governance of LLMs-driven social bots within the research community.",Sichuan University
6,./images/are_you_in_a_20230719.png,BattleAgent: Multi-modal Dynamic Emulation on Historical Battles to Complement Historical Analysis,"Shuhang Lin, Wenyue Hua, Lingyao Li, Che-Jui Chang, Lizhou Fan, Jianchao Ji, Hang Hua, Mingyu Jin, Jiebo Luo, Yongfeng Zhang","This paper presents BattleAgent, a detailed emulation demonstration system thatcombines the Large Vision-Language Model (VLM) and Multi-Agent System(MAS). This novel system aims to simulate complex dynamic interactions amongmultiple agents, as well as between agents and their environments, over a period oftime. It emulates both the decision-making processes of leaders and the viewpointsof ordinary participants, such as soldiers. The emulation showcases the currentcapabilities of agents, featuring fine-grained multi-modal interactions betweenagents and landscapes. It develops customizable agent structures to meet specificsituational requirements, for example, a variety of battle-related activities likescouting and trench digging. These components collaborate to recreate historicalevents in a lively and comprehensive manner while offering insights into thethoughts and feelings of individuals from diverse viewpoints. The technologicalfoundations of BattleAgent establish detailed and immersive settings for historicalbattles, enabling individual agents to partake in, observe, and dynamically respondto evolving battle scenarios. This methodology holds the potential to substantiallydeepen our understanding of historical events, particularly through individualaccounts. Such initiatives can also aid historical research, as conventional historicalnarratives often lack documentation and prioritize the perspectives of decision-makers, thereby overlooking the experiences of ordinary individuals. This biaseddocumentation results in a considerable gap in our historical understanding, as manystories remain untold......","Rutgers University, University of Michigan, University of Rochester"
7,./images/battleagent_multi-modal_dynamic_emulation_20240423.png,Can Large Language Model Agents Simulate Human Trust Behaviors?,"Chengxing Xie, Canyu Chen, Feiran Jia, Ziyu Ye, Kai Shu, Adel Bibi, Ziniu Hu, Philip Torr, Bernard Ghanem, Guohao Li","Large Language Model (LLM) agents have beenincreasingly adopted as simulation tools to modelhumans in applications such as social science.However, one fundamental question remains: canLLM agents really simulate human behaviors? Inthis paper, we focus on one of the most criticalbehaviors in human interactions, trust, and aim toinvestigate whether or not LLM agents can sim-ulate human trust behaviors. We first find thatLLM agents generally exhibit trust behaviors, re-ferred to as agent trust, under the framework ofTrust Games, which are widely recognized in be-havioral economics. Then, we discover that LLMagents can have high behavioral alignment withhumans regarding trust behaviors, particularly forGPT-4, indicating the feasibility to simulate hu-man trust behaviors with LLM agents. In addition,we probe into the biases in agent trust and thedifferences in agent trust towards agents and hu-mans. We also explore the intrinsic properties ofagent trust under conditions including advancedreasoning strategies and external manipulations.We further offer important implications of ourdiscoveries for various scenarios where trust isparamount. Our study provides new insights intothe behaviors of LLM agents and the fundamentalanalogy between LLMs and humans.","KAUST, Illinois Institute of Technology, Pennsylvania State University, The University of Chicago, University of Oxford, California Institute of Technology"
8,./images/can_large_language_model_20240207.png,ChatDev: Communicative Agents for Software Development,"Chen Qian, Wei Liu, Hongzhang Liu, Nuo Chen, Yufan Dang, Jiahao Li, Cheng Yang, Weize Chen, Yusheng Su, Xin Cong, Juyuan Xu, Dahai Li, Zhiyuan Liu, Maosong Sun","Software development is a complex task thatnecessitates cooperation among multiple mem-bers with diverse skills. Numerous studies useddeep learning to improve specific phases in awaterfall model, such as design, coding, andtesting.However, the deep learning modelin each phase requires unique designs, lead-ing to technical inconsistencies across variousphases, which results in a fragmented and in-effective development process. In this paper,we introduce ChatDev, a chat-powered soft-ware development framework in which special-ized agents driven by large language models(LLMs) are guided in what to communicate(via chat chain) and how to communicate (viacommunicative dehallucination). These agentsactively contribute to the design, coding, andtesting phases through unified language-basedcommunication, with solutions derived fromtheir multi-turn dialogues. We found their uti-lization of natural language is advantageousfor system design, and communicating in pro-gramming language proves helpful in debug-ging. This paradigm demonstrates how linguis-tic communication facilitates multi-agent col-laboration, establishing language as a unify-ing bridge for autonomous task-solving amongLLM agents. The code and data are availableat https://github.com/OpenBMB/ChatDev.","Tsinghua University, The University of Sydney, BUPT, Modelbest Inc."
9,./images/chatdev_communicative_agents_for_20230716.png,CompeteAI: Understanding the Competition Dynamics in Large Language Model-based Agents,"Qinlin Zhao, Jindong Wang, Yixuan Zhang, Yiqiao Jin, Kaijie Zhu, Hao Chen, Xing Xie","Large language models (LLMs) have been widelyused as agents to complete different tasks, suchas personal assistance or event planning. Whilemost of the work has focused on cooperationand collaboration between agents, little workexplores competition, another important mech-anism that promotes the development of soci-ety and economy. In this paper, we seek to ex-amine the competition dynamics in LLM-basedagents. We first propose a general framework forstudying the competition between agents. Then,we implement a practical competitive environ-ment using GPT-4 to simulate a virtual town withtwo types of agents, including restaurant agentsand customer agents. Specifically, the restaurantagents compete with each other to attract morecustomers, where competition encourages themto transform, such as cultivating new operatingstrategies. Simulation experiments reveal severalinteresting findings at the micro and macro lev-els, which align well with existing market andsociological theories. We hope that the frame-work and environment can be a promising testbedto study the competition that fosters understand-ing of society. Code is available at: https://github.com/microsoft/competeai.","University of Science and Technology of China, Microsoft Research, William & Mary, Georgia Institute of Technology, Carnegie Mellon University"
10,./images/competeai_understanding_the_competition_20231026.png,EconAgent: Large Language Model-Empowered Agents for Simulating Macroeconomic Activities,"Nian Li, Chen Gao, Mingyu Li, Yong Li, Qingmin Liao","The advent of artificial intelligence has led to agrowing emphasis on data-driven modeling inmacroeconomics, with agent-based modeling(ABM) emerging as a prominent bottom-upsimulation paradigm. In ABM, agents (e.g.,households, firms) interact within a macroe-conomic environment, collectively generatingmarket dynamics. Existing agent modeling typ-ically employs predetermined rules or learning-based neural networks for decision-making.However, customizing each agent presents sig-nificant challenges, complicating the modelingof agent heterogeneity. Additionally, the in-fluence of multi-period market dynamics andmultifaceted macroeconomic factors are oftenoverlooked in decision-making processes. Inthis work, we introduce EconAgent, a largelanguage model-empowered agent with human-like characteristics for macroeconomic simu-lation. We first construct a simulation envi-ronment that incorporates various market dy-namics driven by agents’ decisions regardingwork and consumption. Through the perceptionmodule, we create heterogeneous agents withdistinct decision-making mechanisms.Fur-thermore, we model the impact of macroeco-nomic trends using a memory module, whichallows agents to reflect on past individual ex-periences and market dynamics. Simulationexperiments show that EconAgent can makerealistic decisions, leading to more reasonablemacroeconomic phenomena compared to exist-ing rule-based or learning-based agents. Ourcodes are released at https://github.com/tsinghua-fib-lab/ACL24-EconAgent.",Tsinghua University
11,./images/econagent_large_language_model-empowered_20231016.png,Epidemic Modeling with Generative Agents,"Ross Williams, Niyousha Hosseinichimeh, Aritra Majumdar, Navid Ghaffarzadegan","This study offers a new paradigm of individual-level modeling to address the grand challenge of incorporating human behavior in epidemic models. Using generative artificial intelligence in an agent-based epidemic model, each agent is empowered to make its own reasonings and decisions via connecting to a large language model such as ChatGPT. Through various simulation experiments, we present compelling evidence that generative agents mimic real-world behaviors such as quarantining when sick and self-isolation when cases rise. Collectively, the agents demonstrate patterns akin to multiple waves observed in recent pandemics followed by an endemic period. Moreover, the agents successfully flatten the epidemic curve. This study creates potential to improve dynamic system modeling by offering a way to represent human brain, reasoning, and decision making.",Virginia Tech
12,./images/epidemic_modeling_with_generative_20230711.png,Exploring Collaboration Mechanisms for LLM Agents: A Social Psychology View,"Jintian Zhang, Xin Xu, Ningyu Zhang, Ruibo Liu, Bryan Hooi, Shumin Deng","As Natural Language Processing (NLP) sys-tems are increasingly employed in intricate so-cial environments, a pressing query emerges:Can these NLP systems mirror human-esquecollaborative intelligence, in a multi-agent so-ciety consisting of multiple large language mod-els (LLMs)? This paper probes the collabora-tion mechanisms among contemporary NLPsystems by melding practical experiments withtheoretical insights. We fabricate four unique‘societies’ comprised of LLM agents, whereeach agent is characterized by a specific ‘trait’(easy-going or overconfident) and engages incollaboration with a distinct ‘thinking pattern’(debate or reflection).Through evaluatingthese multi-agent societies on three benchmarkdatasets, we discern that certain collaborativestrategies not only outshine previous top-tierapproaches but also optimize efficiency (usingfewer API tokens). Moreover, our results fur-ther illustrate that LLM agents manifest human-like social behaviors, such as conformity andconsensus reaching, mirroring foundational so-cial psychology theories. In conclusion, weintegrate insights from social psychology tocontextualize the collaboration of LLM agents,inspiring further investigations into the collab-oration mechanism for LLMs. We have sharedour code and datasets1, hoping to catalyze fur-ther research in this promising avenue.","Zhejiang University, National University of Singapore, NUS-NCS Joint Lab, Google DeepMind"
13,./images/exploring_collaboration_mechanisms_for_20231003.png,Generative Agents: Interactive Simulacra of Human Behavior,"Joon Sung Park, Joseph C. O'Brien, Carrie J. Cai, Meredith Ringel Morris, Percy Liang, Michael S. Bernstein","Believable proxies of human behavior can empower interactive applications ranging from immersive environments to rehearsal spaces for interpersonal communication to prototyping tools. In this paper, we introduce generative agents--computational software agents that simulate believable human behavior. Generative agents wake up, cook breakfast, and head to work; artists paint, while authors write; they form opinions, notice each other, and initiate conversations; they remember and reflect on days past as they plan the next day. To enable generative agents, we describe an architecture that extends a large language model to store a complete record of the agent's experiences using natural language, synthesize those memories over time into higher-level reflections, and retrieve them dynamically to plan behavior. We instantiate generative agents to populate an interactive sandbox environment inspired by The Sims, where end users can interact with a small town of twenty five agents using natural language. In an evaluation, these generative agents produce believable individual and emergent social behaviors: for example, starting with only a single user-specified notion that one agent wants to throw a Valentine's Day party, the agents autonomously spread invitations to the party over the next two days, make new acquaintances, ask each other out on dates to the party, and coordinate to show up for the party together at the right time. We demonstrate through ablation that the components of our agent architecture--observation, planning, and reflection--each contribute critically to the believability of agent behavior. By fusing large language models with computational, interactive agents, this work introduces architectural and interaction patterns for enabling believable simulations of human behavior.","Stanford University, Google Research, Google DeepMind"
14,./images/generative_agents_interactive_simulacra_20230407.png,Humanoid Agents: Platform for Simulating Human-like Generative Agents,"Zhilin Wang, Yu Ying Chiu, Yu Cheung Chiu","Just as computational simulations of atoms, molecules and cells have shaped the way we study the sciences, true-to-life simulations of human-like agents can be valuable tools for studying human behavior. We propose Humanoid Agents, a system that guides Generative Agents to behave more like humans by introducing three elements of System 1 processing: Basic needs (e.g. hunger, health and energy), Emotion and Closeness in Relationships. Humanoid Agents are able to use these dynamic elements to adapt their daily activities and conversations with other agents, as supported with empirical experiments. Our system is designed to be extensible to various settings, three of which we demonstrate, as well as to other elements influencing human behavior (e.g. empathy, moral values and cultural background). Our platform also includes a Unity WebGL game interface for visualization and an interactive analytics dashboard to show agent statuses over time.","University of Washington, NVIDIA, The University of Hong Kong"
15,./images/humanoid_agents_platform_for_20231009.png,Language Agents as Digital Representatives in Collective Decision-Making,"Jarrett, Daniel and Pislar, Miruna and Bakker, Michiel A and Tessler, Michael Henry and Koster, Raphael and Balaguer, Jan and Elie, Romuald and Summerfield, Christopher and Tacchetti, Andrea","Consider the process of collective decision-making, in which a group of individualsinteractively select a preferred outcome from among a universe of alternatives. Inthis context, “representation” is the activity of making an individual’s preferencespresent in the process via participation by a proxy agent—i.e. their “representative”.To this end, learned models of human behavior have the potential to fill this role,with practical implications for multi-agent scenario studies and mechanism design.In this work, we investigate the possibility of training language agents to behavein the capacity of representatives of human agents, appropriately expressing thepreferences of those individuals whom they stand for. First, we formalize the settingof collective decision-making—as the episodic process of interaction between agroup of agents and a decision mechanism. On this basis, we then formalize theproblem of digital representation—as the simulation of an agent’s behavior to yieldequivalent outcomes from the mechanism. Finally, we conduct an empirical casestudy in the setting of consensus-finding among diverse humans, and demonstratethe feasibility of fine-tuning large language models to act as digital representatives.",Google DeepMind
